{
  "$id": "https://flametrench.dev/conformance/fixture.schema.json",
  "$schema": "https://json-schema.org/draft/2020-12/schema",
  "title": "Flametrench Conformance Fixture",
  "description": "A single conformance fixture file: one capability, one operation family, one or more test vectors.",
  "type": "object",
  "required": ["spec_version", "capability", "operation", "conformance_level", "description", "tests"],
  "additionalProperties": false,
  "properties": {
    "$schema": {
      "type": "string",
      "description": "Optional pointer to this schema for editor tooling."
    },
    "spec_version": {
      "type": "string",
      "pattern": "^[0-9]+\\.[0-9]+\\.[0-9]+$",
      "description": "The specific Flametrench spec version this fixture file targets."
    },
    "capability": {
      "type": "string",
      "enum": ["ids", "identity", "tenancy", "authorization", "audit", "file-metadata", "flags", "notifications"],
      "description": "Which Flametrench capability this fixture exercises."
    },
    "operation": {
      "type": "string",
      "pattern": "^[a-z][a-z0-9_]+$",
      "description": "Canonical operation name — matches the SDK/API method being validated (e.g. `encode`, `decode`, `check`). For state-machine fixtures, name the primary operation under test (e.g. `self_leave`, `accept_invitation`)."
    },
    "conformance_level": {
      "type": "string",
      "enum": ["MUST", "SHOULD", "MAY"],
      "description": "RFC 2119 level. MUST failures prevent an implementation from claiming conformance; SHOULD failures produce warnings; MAY is informational."
    },
    "spec_section": {
      "type": "string",
      "description": "Path + anchor into the normative spec prose that authorizes this fixture (e.g. `docs/ids.md#decoding-rules`)."
    },
    "description": {
      "type": "string",
      "minLength": 1,
      "description": "One-line summary of what this fixture file validates."
    },
    "tests": {
      "type": "array",
      "minItems": 1,
      "items": { "$ref": "#/$defs/Test" }
    },
    "shared": {
      "type": "object",
      "description": "v0.2 only: optional fixture-level inputs that every test in the file shares. Harnesses MUST merge these into each test's input map before invocation. Useful for fixtures where 90% of input is constant (e.g. WebAuthn assertion keypair + RP ID) and only a few fields vary across tests."
    }
  },
  "$defs": {
    "Test": {
      "type": "object",
      "required": ["id", "description"],
      "additionalProperties": false,
      "description": "A single test vector. Either single-step (input + expected) or state-machine (users + steps).",
      "properties": {
        "id": {
          "type": "string",
          "pattern": "^[a-z0-9][a-z0-9_.-]*$",
          "description": "Stable identifier for this individual test. Unique within the fixture file. Used for grepping and reporting."
        },
        "description": {
          "type": "string",
          "minLength": 1,
          "description": "What this specific test validates."
        },
        "input": {
          "type": "object",
          "description": "Single-step form: the input arguments to the operation. Shape depends on the operation."
        },
        "expected": {
          "$ref": "#/$defs/Expected",
          "description": "Single-step form: the expected outcome of the operation."
        },
        "users": {
          "type": "array",
          "items": {
            "type": "string",
            "pattern": "^[a-z][a-z0-9_]*$"
          },
          "description": "State-machine form: declares named user variables. The harness pre-allocates a fresh `usr_` ID for each name; steps reference them via `{name}`."
        },
        "steps": {
          "type": "array",
          "minItems": 1,
          "items": { "$ref": "#/$defs/Step" },
          "description": "State-machine form: ordered list of operations the harness invokes against a fresh store. Each step's result MAY be captured for later substitution."
        },
        "rules": {
          "type": "object",
          "description": "v0.2 only: optional authz rewrite rules to register with the store before running the test. Keys are object_type values; each maps to a relation→rule map. Per ADR 0007.",
          "additionalProperties": {
            "type": "object",
            "additionalProperties": {
              "type": "array",
              "items": { "$ref": "#/$defs/RuleNode" }
            }
          }
        }
      },
      "oneOf": [
        { "required": ["input", "expected"] },
        { "required": ["steps"] }
      ]
    },
    "RuleNode": {
      "type": "object",
      "description": "A single primitive in a rewrite-rule union. v0.2 supports three node types: this, computed_userset, tuple_to_userset.",
      "required": ["type"],
      "additionalProperties": false,
      "properties": {
        "type": {
          "type": "string",
          "enum": ["this", "computed_userset", "tuple_to_userset"]
        },
        "relation": {
          "type": "string",
          "description": "For computed_userset: the relation to recurse with on the same object."
        },
        "tupleset_relation": {
          "type": "string",
          "description": "For tuple_to_userset: the relation traversed on the current object."
        },
        "computed_userset_relation": {
          "type": "string",
          "description": "For tuple_to_userset: the relation to check on each subject reached via the tupleset hop."
        }
      }
    },
    "Step": {
      "type": "object",
      "required": ["op", "input"],
      "additionalProperties": false,
      "description": "One step of a state-machine test. Invokes `op` on the store with `input`. If `expected.error` is present, the step MUST throw the named error and the test ends. Otherwise the step MUST succeed; values from the result MAY be captured by name for later substitution.",
      "properties": {
        "op": {
          "type": "string",
          "pattern": "^[a-z][a-z0-9_]+$",
          "description": "Operation name, matching the SDK method (e.g. `create_org`, `self_leave`). The harness translates this to the language-idiomatic method name."
        },
        "input": {
          "type": "object",
          "description": "Operation arguments. String values matching the pattern `{var}` are resolved against the test's variable map (declared users + previous captures) before invocation."
        },
        "captures": {
          "type": "object",
          "additionalProperties": { "type": "string" },
          "description": "Map of capture-name → dotted-path-into-result. After the step succeeds, the harness extracts each value and stores it under the capture name for later substitution. Paths use dot notation: `owner_membership.id`, `invitation.org_id`."
        },
        "expected": {
          "$ref": "#/$defs/Expected"
        }
      }
    },
    "Expected": {
      "type": "object",
      "additionalProperties": false,
      "description": "Exactly one of `result` or `error` MUST be present. `result` asserts a successful return value; `error` asserts that the operation throws/raises an error of the named type.",
      "properties": {
        "result": {
          "description": "The expected return value. Shape depends on the operation."
        },
        "error": {
          "type": "string",
          "description": "The name of the error type the operation MUST throw. Must match one of the spec-defined error names (e.g. `InvalidIdError`, `SoleOwnerError`)."
        },
        "error_matches": {
          "type": "string",
          "description": "Optional: a substring the error's human-readable message MUST contain. Use sparingly — over-specifying message text makes fixtures fragile across SDKs with different phrasings."
        }
      },
      "oneOf": [
        { "required": ["result"] },
        { "required": ["error"] }
      ]
    }
  }
}
